Headline,Crypto,Positive,Negative,Neutral
"Litecoin Beats Out Dogecoin, Bitcoin To Emerge As Top Crypto For Payments - NewsBTC",litecoin,0.8854898810386658,0.009900969453155994,0.009900969453155994
"Litecoin is Predicted to Drop to $ 74.23 By Mar 14, 2024 - CoinCodex",litecoin,0.006442657671868801,0.9581176042556763,0.9581176042556763
Airdrop Alert: Grab Your Free Litecoin $LTC Today - Medium,litecoin,0.09924740344285965,0.013824926689267159,0.013824926689267159
Litecoin Leads Crypto Payment on BitPay - Crypto Times,litecoin,0.046194858849048615,0.012872769497334957,0.012872769497334957
LitecoinPrice Prediction 2024 - CCN.com,litecoin,0.02646546997129917,0.02255702018737793,0.02255702018737793
"Litecoin (LTC) Ignites Investors Interest, New Meme Coin Bullish Momentum Continues - The Crypto Basic",litecoin,0.6760953068733215,0.018009256571531296,0.018009256571531296
Litecoin (LTC) Price Analysis: Rally Could Resume Toward $100 - Live Bitcoin News,litecoin,0.8751152753829956,0.02813214249908924,0.02813214249908924
Litecoin Falls 11% In Rout By Investing.com - Investing.com,litecoin,0.015496710315346718,0.905701756477356,0.905701756477356
Litecoin (LTC) Do the Risks Outweigh the Rewards Friday? - InvestorsObserver,litecoin,0.0712980180978775,0.01734411157667637,0.01734411157667637
"Underrated Passive Income Cryptos: Make Money with Litecoin, Uniswap, and Scorpion Casino - Analytics Insight",litecoin,0.0687781572341919,0.010626226663589478,0.010626226663589478
"Litecoin Eyes $100 Milestone After 33% Price Liftoff, Bulls Target $250 Next - Blockonomi",litecoin,0.21536338329315186,0.01951080560684204,0.01951080560684204
Litecoin Price Continues Rising After Breaking Above $70 - CoinIdol,litecoin,0.9470607042312622,0.022042175754904747,0.022042175754904747
Litecoin (LTC) Outshines Bitcoin As Top Payment Option: Data - CoinGape,litecoin,0.4394872486591339,0.009723732247948647,0.009723732247948647
"Litecoin Gained 27.37% in Last Month and is Predicted to Drop to $ 80.46 By Mar 10, 2024 - CoinCodex",litecoin,0.007097823545336723,0.9713184237480164,0.9713184237480164
"Litecoin (LTC) has a Neutral Sentiment Score, is Falling, and Underperforming the Crypto Market Monday: What's Next? - InvestorsObserver",litecoin,0.010755686089396477,0.9557948708534241,0.9557948708534241
Litecoin (LTC) Up 1.82% Thursday: What's Next? - InvestorsObserver,litecoin,0.5136512517929077,0.02740018628537655,0.02740018628537655
Litecoin (LTC): Does it Score Poorly on Long-Term Trading Metrics Wednesday? - InvestorsObserver,litecoin,0.015990788117051125,0.952198326587677,0.952198326587677
Celebrating Litecoin's Steadfast Investors; Render Faces Strong Competition - Finbold - Finance in Bold,litecoin,0.8993194103240967,0.008163826540112495,0.008163826540112495
"Litecoin records first big milestone in 2024, but there is a problem - AMBCrypto News",litecoin,0.0528792142868042,0.31623995304107666,0.31623995304107666
"Litecoin (LTC) Teases Monumental Upgrade, Key Implications for Price - CryptoDaily",litecoin,0.810059666633606,0.01558208279311657,0.01558208279311657
Best 6 LTC Casinos – Top Litecoin Gambling Sites Reviewed In 2024 - NewsBTC,litecoin,0.10453515499830246,0.01694205403327942,0.01694205403327942
Why are Ethereum Whales Turning to BlockDAG Presale Despite Litecoin (LTC) Surge? - Coinfomania,litecoin,0.06219501793384552,0.03691598400473595,0.03691598400473595
10 Best Cryptocurrencies To Buy In March 2024 - Forbes,litecoin,0.12875902652740479,0.010956570506095886,0.010956570506095886
Rebel Satoshi ($RBLZ) investors enjoy community rewards while Litecoin (LTC) approaches $100 - Invezz,litecoin,0.7493300437927246,0.010679209604859352,0.010679209604859352
Pushd (PUSHD) Presale: Tron (TRX) and Litecoin (LTC) Investors Navigate the Excitement - Bitcoin (BTC) Stability at ... - CryptoDaily,litecoin,0.3494538962841034,0.011584214866161346,0.011584214866161346
"Binance Coin (BNB) & Litecoin (LTC) Celebrate Kelexo (KLXO) Presale at $0.04: Ethereum (ETH) Surges to $3,800 ... - NewsBTC",litecoin,0.9114887714385986,0.016009381040930748,0.016009381040930748
"Chainlink (LINK) Could Shape Bitcoin ETF Success, Litecoin’s (LTC) Market Twist Shocks Investors – Get the Scoop! - CryptoDaily",litecoin,0.26492807269096375,0.01403007935732603,0.01403007935732603
"Whales Abruptly Move $350,000,000 in Bitcoin, Ethereum, Solana, Litecoin and XRP – Here’s Where the Crypto Is Headed - The Daily Hodl",litecoin,0.025780970230698586,0.09610770642757416,0.09610770642757416
Litecoin (LTC) & Solana (SOL) Surge As Raffle Coin (RAFF) Presale Shadows Shiba Inu (SHIB) 115% 7D Gains - CryptoDaily,litecoin,0.9362099766731262,0.03157065436244011,0.03157065436244011
"ChatGPT on BlockDAG, Litecoin Trend, VeChain Price Prediction: 5000% Rally Ahead - Crypto Reporter",litecoin,0.3665759861469269,0.013961336575448513,0.013961336575448513
"Litecoin Whales Make a $230M Move as Bitcoin Halving Approaches - CryptoTicker.io - Bitcoin Price, Ethereum Price & Crypto News",litecoin,0.16646842658519745,0.013975108042359352,0.013975108042359352
Litecoin (LTC): How Risky is It Sunday? - InvestorsObserver,litecoin,0.046640489250421524,0.022235117852687836,0.022235117852687836
Litecoin Price Prediction 2024 – 2030: Will LTC Price Cross $100 in 2024? - Coinpedia Fintech News,litecoin,0.08145789057016373,0.012476867996156216,0.012476867996156216
Litecoin Climbs 10% In Rally By Investing.com - Investing.com,litecoin,0.8735687136650085,0.019458167254924774,0.019458167254924774
Raffle Coin (RAFF) Streaming Sensation: Chainlink (LINK) and Litecoin (LTC) Investors Eyeing 50X Gains with Shiba ... - CryptoDaily,litecoin,0.8296534419059753,0.00944937951862812,0.00944937951862812
GameFi Star Scorpion Casino Pulls in Crypto Investors as Litecoin (LTC) and Tron (TRX) Weakens - Analytics Insight,litecoin,0.014143326319754124,0.953772783279419,0.953772783279419
What Is Litecoin? - The Motley Fool,litecoin,0.023897189646959305,0.13117285072803497,0.13117285072803497
Best Litecoin (LTC) Casinos and Gambling Sites in 2024 - ReadWrite,litecoin,0.2519848346710205,0.009116568602621555,0.009116568602621555
Litecoin celebrates two milestones as it struggles to hold relevancy - Blockworks,litecoin,0.9271481037139893,0.03404943645000458,0.03404943645000458
Cryptocurrency Litecoin Down More Than 4% Within 24 hours By Benzinga - Investing.com UK,litecoin,0.007053920533508062,0.9612820744514465,0.9612820744514465
Exploring Top Crypto Buys: Scorpion Casino's Potential Parallel to Litecoin and Uniswap - Analytics Insight,litecoin,0.2571341097354889,0.007644637953490019,0.007644637953490019
Will Litecoin (LTC) Price Reach New Highs in 2024? - BeInCrypto,litecoin,0.18468530476093292,0.01049020979553461,0.01049020979553461
What is Litecoin (LTC)? How It Works & Why It Still Matters - Techopedia,litecoin,0.026797739788889885,0.02590879052877426,0.02590879052877426
"Why Bitcoin Cash, Ethereum Classic, and Litecoin Are Surging Today - The Motley Fool",litecoin,0.11016698181629181,0.024393310770392418,0.024393310770392418
Litecoin (LTC) Down 0.01% Friday: What's Next? - InvestorsObserver,litecoin,0.0120840510353446,0.9378823041915894,0.9378823041915894
DeeStream (DST) Huge 100X Presale: Shiba Inu (SHIB) Bulls Intrigued by 125% Surge Whilst Litecoin (LTC) and ... - NewsBTC,litecoin,0.939643919467926,0.014018247835338116,0.014018247835338116
Should you pick Litecoin for the next bull run? Data suggests... - AMBCrypto News,litecoin,0.07468245923519135,0.014839290641248226,0.014839290641248226
Litecoin wallets are liquidating – Will it affect LTC price predictions? - AMBCrypto English,litecoin,0.02873915061354637,0.06613726913928986,0.06613726913928986
"Focus on Litecoin ahead of Bitcoin halving, Solana traders switch to KangaMoon - crypto.news",litecoin,0.1018732339143753,0.05788532271981239,0.05788532271981239
Why Litecoin Popped More than 5% Today - The Motley Fool,litecoin,0.14418447017669678,0.03604213893413544,0.03604213893413544
Litecoin: What’s under the microscope after LTC’s 24% 7-day hike? - AMBCrypto News,litecoin,0.0590098574757576,0.04544610530138016,0.04544610530138016
Litecoin Addresses Pump But Price Recedes Just as Quickly - CCN.com,litecoin,0.08350440859794617,0.022265508770942688,0.022265508770942688
What Does Litecoin Have to Do to Close the Gap on Bitcoin? - FinSMEs,litecoin,0.06962686032056808,0.01482090912759304,0.01482090912759304
"Litecoin (LTC) partnerships, integrations and collaborations - Racine County Eye",litecoin,0.2676299214363098,0.007559847552329302,0.007559847552329302
Litecoin Plunges 6% to Fresh Monthly Lows on Halving Day - CoinDesk,litecoin,0.011351323686540127,0.9655680656433105,0.9655680656433105
Should You Buy Litecoin (LTC) Monday? - InvestorsObserver,litecoin,0.0687844455242157,0.011466682888567448,0.011466682888567448
Litecoin: Is this analysis hinting towards a price rally? - AMBCrypto News,litecoin,0.10862891376018524,0.04596830904483795,0.04596830904483795
Bitcoin Vs. Litecoin (2024 Edition) - Securities.io,litecoin,0.08812306076288223,0.014330378733575344,0.014330378733575344
Litecoin price recovery of 10% crash likely as Grayscale paves way to convert LTC trust into ETF - FXStreet,litecoin,0.947517991065979,0.01652185432612896,0.01652185432612896
Litecoin’s impressive mining stats fail to shield LTC - AMBCrypto News,litecoin,0.6327879428863525,0.322533518075943,0.322533518075943
Should I Buy Litecoin – Is Litecoin a Good Investment in 2024? - Techopedia,litecoin,0.15098069608211517,0.009508347138762474,0.009508347138762474
Want The Best Way To Make Money In Crypto? Here's How Scorpion Casino Can Eclipse Litecoin And Polkadot - Analytics Insight,litecoin,0.07783937454223633,0.01393959391862154,0.01393959391862154
Litecoin Beats Bitcoin On This Crucial Metric - CCN.com,litecoin,0.15486958622932434,0.012340597808361053,0.012340597808361053
"Litecoin Whale Deposits Big To Binance, LTC’s 3% Drop To Extend? - NewsBTC",litecoin,0.4358385503292084,0.47956398129463196,0.47956398129463196
Why is Litecoin price up today? - Cointelegraph,litecoin,0.1161075234413147,0.024466440081596375,0.024466440081596375
Litecoin Falls 10.57% In Bearish Trade - Investing.com India,litecoin,0.01451029907912016,0.9561352729797363,0.9561352729797363
"As Bitcoin Hits $64,000, Bulls Prep Moonshot in Bitcoin Cash And Litecoin! - Coinpedia Fintech News",litecoin,0.5108380913734436,0.017871521413326263,0.017871521413326263
Should You Buy Litecoin While It's Still Down? - The Motley Fool,litecoin,0.04110432788729668,0.05245072767138481,0.05245072767138481
"Litecoin ‘Halving,’ Set for Wednesday, Should Harden Supply of ‘Digital Silver’ - CoinDesk",litecoin,0.6663996577262878,0.024216800928115845,0.024216800928115845
Analysts Point To Algotech For 2024 Gains: Is It A Better Buy Than Polkadot Or Litecoin? - Analytics Insight,litecoin,0.6630727648735046,0.009450498037040234,0.009450498037040234
Where Does Litecoin Go from Here? - Finance Magnates,litecoin,0.029741019010543823,0.03928256407380104,0.03928256407380104
Litecoin price has a long way to go before LTC attempts to tag $85 - FXStreet,litecoin,0.05196155235171318,0.02810908667743206,0.02810908667743206
Litecoin (LTC) Price Rallies After Bitcoin (BTC) Fees Reach $30 - Bloomberg,litecoin,0.24827450513839722,0.7080785632133484,0.7080785632133484
3 Rising Phoenix Cryptos to Grab Before the Rebound - InvestorPlace,litecoin,0.1366107165813446,0.016894882544875145,0.016894882544875145
Litecoin Price Prediction: What to Expect Next From LTC - CCN.com,litecoin,0.03365696594119072,0.023972800001502037,0.023972800001502037
Litecoin prices fall 6% after third halving event - Yahoo Finance,litecoin,0.009578236378729343,0.9666109085083008,0.9666109085083008
"If this is true, Litecoin might kickstart a rally in December - AMBCrypto English",litecoin,0.5605790615081787,0.013565929606556892,0.013565929606556892
"Litecoin (LTC) Hits Massive Milestone, Surpassing BTC - U.Today",litecoin,0.9393534660339355,0.01484376285225153,0.01484376285225153
"XRP, Litecoin (LTC) Witness Stunning $1 Million Inflow Surge - TradingView",litecoin,0.9338967204093933,0.01882867142558098,0.01882867142558098
Investing in Litecoin (LTC) - Everything You Need to Know - Securities.io,litecoin,0.043925847858190536,0.013438052497804165,0.013438052497804165
Why is Litecoin's price down today? - Cointelegraph,litecoin,0.07458172738552094,0.1714220941066742,0.1714220941066742
The Litecoin halving is hours away: Here's what to know - Blockworks,litecoin,0.03535841405391693,0.04506939277052879,0.04506939277052879
Litecoin (LTC) Flashing Bullish Signal Amid Rising Address Activity: Crypto Analytics Firm Santiment - The Daily Hodl,litecoin,0.9067274332046509,0.025054743513464928,0.025054743513464928
Litecoin Halving Dates: When Is the Next LTC Halving? - CoinCodex,litecoin,0.020334875211119652,0.0394304059445858,0.0394304059445858
Litecoin Sees Record Surge in New Addresses and Transactions - BeInCrypto,litecoin,0.8923696279525757,0.010941035114228725,0.010941035114228725
Why You Should Care About Litecoin: It's the Backbone of Dogecoin - Yahoo Finance,litecoin,0.047215402126312256,0.020612604916095734,0.020612604916095734
"Litecoin Halving Unlikely to Drive Immediate Price Gains, Past Data Show - CoinDesk",litecoin,0.6867013573646545,0.1039051041007042,0.1039051041007042
ChatGPT predicts Litecoin price for the start of 2024 - Finbold - Finance in Bold,litecoin,0.07121692597866058,0.015172092244029045,0.015172092244029045
Litecoin (LTC) Now Accepted for Microsoft Payments: Details - U.Today,litecoin,0.05287674069404602,0.012521191500127316,0.012521191500127316
Will Litecoin (LTC) Price Hold Above Support? - BeInCrypto,litecoin,0.16732893884181976,0.009759877808392048,0.009759877808392048
"Understanding the Tokenomics of Fantom Airdrop Token Distribution | by PerezDefiBrigade | Mar, 2024 - Medium",fantom,0.053727198392152786,0.014462471939623356,0.014462471939623356
"Fantom Price Prediction 2024, 2025, 2030: Will FTM Price Surge To $1 This Year? - Coinpedia Fintech News",fantom,0.6627718210220337,0.01638287678360939,0.01638287678360939
Fantom Price: Here Is How FTM Could Soon Reach $0.96 - BeInCrypto,fantom,0.057327669113874435,0.015130708925426006,0.015130708925426006
"Dogecoin (DOGE) and Fantom (FTM) Rally, This New Meme Coin Records Massive Surge Drawing Traders' Attention - DailyCoin",fantom,0.8951153755187988,0.015284583903849125,0.015284583903849125
Fantom whales now busy scooping up FTM – Is this a bullish sign? - AMBCrypto News,fantom,0.05942603945732117,0.03560851514339447,0.03560851514339447
Fantom (FTM) Price Eyes Rally Above $1 Amid Strong Whale Accumulation - CoinGape,fantom,0.9386650919914246,0.030243460088968277,0.030243460088968277
Fantom (FTM) Foundation secures default judgment against Multichain Foundation - crypto.news,fantom,0.2816831171512604,0.054561588913202286,0.054561588913202286
"Fantom (FTM) Skyrockets 31% in Astonishing Comeback, Here's Why - U.Today",fantom,0.16213242709636688,0.03944484889507294,0.03944484889507294
Fantom Seeks Money Back From Multichain's $200M Exploit - Yahoo Finance,fantom,0.8152801394462585,0.012000893242657185,0.012000893242657185
Fantom seeks Multichain liquidation in attempt to recover $122M from exploit - Cointelegraph,fantom,0.02799655683338642,0.41682159900665283,0.41682159900665283
"Fantom ($FTM) Sees Impressive 31% Surge, Market Cap Hits 22-Month High - The Merkle Hash",fantom,0.945432722568512,0.021099308505654335,0.021099308505654335
Fantom (FTM) Receives a Bullish Rating Monday: Is it Time to Get on Board? - InvestorsObserver,fantom,0.8646427392959595,0.015843022614717484,0.015843022614717484
"Best Crypto to Buy Today March 4 – Bonk, Pepe, Fantom - Cryptonews",fantom,0.17199301719665527,0.00985283125191927,0.00985283125191927
Fantom price rallies after FTM Foundation’s legal win against Multichain Foundation - FXStreet,fantom,0.39560750126838684,0.5708386301994324,0.5708386301994324
FTM Price Prediction: Will Fantom Surpass $1 This Week? - Coinpedia Fintech News,fantom,0.2194422483444214,0.00996292196214199,0.00996292196214199
"Fantom Bonanza: Dive into Our Airdrop! | by UFO Cosmos Peach | Mar, 2024 - Medium",fantom,0.03299020603299141,0.03298700600862503,0.03298700600862503
Fantom Price Climbs Over a 22-Month Wall: Is the Path to $1 Clear? - CoinGape,fantom,0.2232760190963745,0.020877279341220856,0.020877279341220856
Fantom Foundation To Take Action Against Multichain Exploit - BeInCrypto,fantom,0.07063589245080948,0.03975754976272583,0.03975754976272583
"Fantom (FTM) Price Now Aims At ATH, With Nearly 400% Rally: Here’s Why - Coinpedia Fintech News",fantom,0.15175087749958038,0.016383716836571693,0.016383716836571693
Fantom Opens Proposal for Refunds in Multichain $130M Exploit - CoinGape,fantom,0.19735509157180786,0.01225009560585022,0.01225009560585022
How to Buy Fantom | Buy FTM in 4 steps (March 2024) - Securities.io,fantom,0.0640372484922409,0.010632963851094246,0.010632963851094246
Biggest Presale of 2024: BlockDAG Raised Over $2.7M In Presale Amid Fantom (FTM) Bullish Trends and Algotech Presale - NewsWatch,fantom,0.9465987086296082,0.030481921508908272,0.030481921508908272
"Will BlockDAG Outrun Giants Like Fantom & Uniswap (UNI)? Analysts Say New Mining Star Likely to Generate 10,000x ROI - Coinfomania",fantom,0.8317901492118835,0.008300036191940308,0.008300036191940308
"Fantom dodges $170m vulnerability, pays $1.7m reward to security researcher - DLNews",fantom,0.7850170135498047,0.03680488467216492,0.03680488467216492
"Fantom Price Prediction – FTM Price Estimated to Reach $ 0.515431 By Feb 23, 2024 - CoinCodex",fantom,0.04843103885650635,0.017583658918738365,0.017583658918738365
Fantom selected as Liberty League Rookie of the Week - Skidmore College Athletics - Skidmore Thoroughbreds,fantom,0.15882107615470886,0.030717937275767326,0.030717937275767326
Fantom cuts staking requirement by 90% in a bid to increase security - Cointelegraph,fantom,0.821659505367279,0.021464522927999496,0.021464522927999496
Tokens Fueling Innovation in the Dynamic Fantom DeFi Ecosystem - Yahoo Finance,fantom,0.43337956070899963,0.007971427403390408,0.007971427403390408
"Fantom Gas Fees Are Surging, What’s Driving The Traffic? - DailyCoin",fantom,0.032337676733732224,0.09039998799562454,0.09039998799562454
Fantom Lowers Staking Requirements: Is FTM Still Secure? - CCN.com,fantom,0.33551037311553955,0.009151590056717396,0.009151590056717396
Fantom Foundation awards $1.7M to researcher for uncovering potential $170M exploit - CryptoSlate,fantom,0.8514639735221863,0.012824662029743195,0.012824662029743195
"Discover Where Crypto Investors Are Placing Their Bets: Scorpion Casino, Fantom or Floki? - Analytics Insight",fantom,0.02684665657579899,0.028104159981012344,0.028104159981012344
Fantom Foundation confirms $550000 stolen from one of its wallets - DLNews,fantom,0.03407572954893112,0.6343984603881836,0.6343984603881836
"Fantom Price Prediction 2024: FTM Rallies, But What Next? - CCN.com",fantom,0.059304364025592804,0.018557919189333916,0.018557919189333916
Fantom's Sonic Breakthrough: A Forward-Thinking Leap in Blockchain: Billionaire Stelian Balta - Yahoo Finance,fantom,0.23986579477787018,0.007940971292555332,0.007940971292555332
Fantom Foundation Wallets Drained; $657K Stolen - CoinDesk,fantom,0.015601737424731255,0.9465596079826355,0.9465596079826355
Fantom Foundation awards $1.7M bounty for preventing $170M drain - Cointelegraph,fantom,0.8950698375701904,0.019726838916540146,0.019726838916540146
Fantom recognized on Liberty League Honor Roll - Skidmore College Athletics - Skidmore Thoroughbreds,fantom,0.10987434536218643,0.013484476134181023,0.013484476134181023
"Fantom (FTM) & THETA Network Retrace, Meme Moguls (MGLS) Poised to Make Waves in the Market - Coinspeaker",fantom,0.7383947968482971,0.010392855852842331,0.010392855852842331
Roland's FANTOM gets an EX-tra upgrade: Now with added ACB! - gearnews.com,fantom,0.41535618901252747,0.009187550283968449,0.009187550283968449
Is Fantom (FTM) About To Explode Like Solana (SOL)? This Analyst Thinks So - NewsBTC,fantom,0.04626748338341713,0.03302740678191185,0.03302740678191185
"Fantom Launches Testnets For Sonic Upgrade, Estimates 6,700% Throughput Gain - Yahoo Finance",fantom,0.7938576340675354,0.01167441625148058,0.01167441625148058
FTM drops 2% in 24 hours: Is Fantom’s network activity why? - AMBCrypto English,fantom,0.014333106577396393,0.9323733448982239,0.9323733448982239
Fantom's 'Foundation Wallets' drained for $550K - Blockworks,fantom,0.03807001933455467,0.034680869430303574,0.034680869430303574
"Fantom Slashes Validator Staking Requirements by 90%, FTM Prices Unchanged - CoinDesk",fantom,0.29573094844818115,0.2991410493850708,0.2991410493850708
What is Fantom? - Messari,fantom,0.022260313853621483,0.05821545422077179,0.05821545422077179
Fantom Foundation Wallets Hacked and Drained in Exploit - Yahoo Finance,fantom,0.011873547919094563,0.9100497364997864,0.9100497364997864
Fantom Foundation hot wallet hacked for $550K - Cointelegraph,fantom,0.07246160507202148,0.01674441061913967,0.01674441061913967
Blockchain Tech 'Stuck in the Eighties': Fantom's Andre Cronje - Decrypt,fantom,0.03554349020123482,0.06055258587002754,0.06055258587002754
FTM Price Could go Parabolic as Fantom Makes Staking 90% More Accessible - CCN.com,fantom,0.039514362812042236,0.11776981502771378,0.11776981502771378
Fantom price prediction: A 70% rally awaits as FTM nearly confirms this historical pattern - FXStreet,fantom,0.5295870900154114,0.02628386579453945,0.02628386579453945
Fantom Staking Has Just Become More Accessible for Validators - BeInCrypto,fantom,0.4004080295562744,0.007297081407159567,0.007297081407159567
Q4 Triumph For Fantom (FTM): Circulating Market Cap Outpaces All Cryptos With 140% Surge - NewsBTC,fantom,0.9307376146316528,0.011010752059519291,0.011010752059519291
This Is How Fantom Plans to Solve Blockchain Scalability - BeInCrypto,fantom,0.0723593458533287,0.01032277476042509,0.01032277476042509
Fantom Blockchain to Return 15% of Gas Fees to Boost Network Usage – Here's What You Need to Know - Cryptonews,fantom,0.1197042167186737,0.009437715634703636,0.009437715634703636
Fantom Foundation Lowers Staking Threshold to 50000 FTM - Blockchain.News,fantom,0.13092368841171265,0.018015116453170776,0.018015116453170776
"Roland FANTOM EX: Modeled analog, classic synths, new effects, more - CDM Create Digital Music - Create Digital Music",fantom,0.04220258444547653,0.017150983214378357,0.017150983214378357
Fantom (FTM) To Rocket Up To $1.60 If This Happens: Analyst - NewsBTC,fantom,0.5264685153961182,0.015087074600160122,0.015087074600160122
Fantom Foundation confirms $550K loss in broader $7M attack - CryptoSlate,fantom,0.010216301307082176,0.968212902545929,0.968212902545929
Stroll a fantastical ‘Fantom Forest' during ‘SkyPark After Dark' - NBC Southern California,fantom,0.04118765890598297,0.0255926251411438,0.0255926251411438
Fantom Price Prediction: A weekly trend break puts 35% gains in the cards for FTM - FXStreet,fantom,0.938857913017273,0.025700196623802185,0.025700196623802185
"Fantom Foundation Hacked for Over $7,000,000 Worth of Ethereum (ETH) and FTM: Report - The Daily Hodl",fantom,0.08034035563468933,0.01189300138503313,0.01189300138503313
Is it Too Late to Buy Fantom? Crypto Experts Give Their Fantom Price Predictions - Cryptonews,fantom,0.021913090720772743,0.04199438542127609,0.04199438542127609
"Which Is the Most Profitable Crypto: Kangamoon (KANG), Pepefork (PORK) or Fantom (FTM)? - NewsBTC",fantom,0.04235696420073509,0.012792231515049934,0.012792231515049934
Fantom’s price jumps 18% – Why the outrage? What of its predictions? - AMBCrypto News,fantom,0.08786137402057648,0.02830289490520954,0.02830289490520954
Fantom Reduces Staking Requirements for Validators - - Altcoin Buzz,fantom,0.4204130172729492,0.011629808694124222,0.011629808694124222
How to Bridge to Fantom? - Watcher Guru,fantom,0.0678401067852974,0.015090919099748135,0.015090919099748135
Oswego County TodayThomas E. Fantom - Oswego Daily News,fantom,0.02844795398414135,0.03418391942977905,0.03418391942977905
"While Fantom Price Explodes, These Coins Might 10x - Cryptonews",fantom,0.06269466131925583,0.015521603636443615,0.015521603636443615
Fantom Vs. Solana - What's the Difference? - Securities.io,fantom,0.044736772775650024,0.021656202152371407,0.021656202152371407
"Exploring growth potential of Filecoin, Fantom, and Everlodge in Q4 2023 - crypto.news",fantom,0.09633690118789673,0.010223609395325184,0.010223609395325184
Fantom Vs. Ethereum – What's the Difference? - Securities.io,fantom,0.048197656869888306,0.01779230497777462,0.01779230497777462
"Fantom (FTM) Suddenly Jumps 18%, Is FTM Dip Finally Over? - U.Today",fantom,0.17712213099002838,0.12242649495601654,0.12242649495601654
State of Fantom Q3 2023 - Messari,fantom,0.03015400655567646,0.0303678959608078,0.0303678959608078
Fantom Crypto (FTM): A Smart Contract-Enabled Blockchain That Promises Scalability? - Bybit Learn,fantom,0.30514517426490784,0.006787468213587999,0.006787468213587999
"Fantom (FTM) Dramatically up 10%, Here's Reason - U.Today",fantom,0.8155954480171204,0.015936709940433502,0.015936709940433502
Investors stockpile Fantom: Will prices see an impact? - AMBCrypto News,fantom,0.048922471702098846,0.029040150344371796,0.029040150344371796
"Best Crypto to Buy Now October 23 – Fantom, Aave, THORChain - Cryptonews",fantom,0.09307505190372467,0.01113553810864687,0.01113553810864687
Fantom Foundation Wallets Drained about $657k in Ether and FTM - Coinspeaker,fantom,0.047014664858579636,0.05566541478037834,0.05566541478037834
Fantom (FTM) Price Gearing for A 200% Price Rally Above This Breakout Level - CoinGape,fantom,0.8286291360855103,0.009958173148334026,0.009958173148334026
